{
  "$schema": "https://json-schema.org/draft/2020-12/schema",
  "$id": "https://raw.githubusercontent.com/emusoi/bango/main/panel.schema.json",
  "title": "bango panel",
  "description": "A screen described as data. A tool prints one of these; a renderer draws it.",
  "type": "object",
  "required": ["bango", "id"],
  "properties": {
    "bango": {
      "const": 1,
      "description": "The document version. A renderer that meets one it does not know says so and exits."
    },
    "id": {
      "$ref": "#/$defs/identifier",
      "description": "Identifies the screen, so a renderer can remember cursor, filter and folds per panel."
    },
    "title": { "type": "string" },
    "subtitle": { "type": "string" },
    "empty": {
      "type": "string",
      "description": "What to say when there are no rows."
    },
    "hints": {
      "type": "array",
      "items": { "type": "string" },
      "description": "Shown along the bottom."
    },
    "order": {
      "type": "array",
      "items": { "$ref": "#/$defs/identifier" },
      "description": "Section ids, as a preference. Unnamed sections follow; a name that is not present is ignored."
    },
    "sections": {
      "type": "array",
      "items": { "$ref": "#/$defs/section" },
      "description": "A panel may have no sections at all: that is an empty state, and `empty` is what it renders."
    },
    "actions": {
      "type": "object",
      "additionalProperties": { "$ref": "#/$defs/action" },
      "description": "Named actions the rows refer to."
    }
  },
  "$defs": {
    "identifier": {
      "type": "string",
      "minLength": 1,
      "pattern": "^[A-Za-z0-9._:/-]+$",
      "description": "Non-empty, and free of spaces."
    },
    "oneLine": {
      "type": "string",
      "pattern": "^[^\\n\\r\\t]*$",
      "description": "A value is one line: no tab, carriage return or newline."
    },
    "section": {
      "type": "object",
      "required": ["id"],
      "properties": {
        "id": { "$ref": "#/$defs/identifier" },
        "label": { "type": "string" },
        "collapsed": { "type": "boolean" },
        "layout": {
          "enum": ["columns", "lines"],
          "description": "How the rows are placed. Columns is the default and aligns them; lines writes each row's one field out as it was given."
        },
        "rows": { "type": "array", "items": { "$ref": "#/$defs/row" } }
      }
    },
    "row": {
      "type": "object",
      "required": ["id", "fields"],
      "properties": {
        "id": {
          "type": "string",
          "minLength": 1,
          "description": "Stable, and unique across the whole panel including children."
        },
        "mark": { "$ref": "#/$defs/mark" },
        "fields": {
          "type": "array",
          "minItems": 1,
          "items": { "$ref": "#/$defs/field" }
        },
        "note": { "$ref": "#/$defs/oneLine" },
        "actions": {
          "type": "array",
          "items": { "type": "string" },
          "description": "Names of the actions legal on this row."
        },
        "facts": { "type": "array", "items": { "type": "string" } },
        "preview": { "type": "array", "items": { "type": "string" } },
        "children": {
          "type": "array",
          "items": { "$ref": "#/$defs/row" },
          "description": "At most 8 deep, which this schema cannot express."
        },
        "dim": { "type": "boolean" },
        "target": {
          "type": "string",
          "description": "The id an action uses instead of this row's own."
        }
      }
    },
    "field": {
      "type": "object",
      "required": ["name", "value"],
      "properties": {
        "name": {
          "type": "string",
          "minLength": 1,
          "description": "Unique within a row. Columns are the union of these, in first-seen order."
        },
        "value": { "$ref": "#/$defs/oneLine" },
        "spans": {
          "type": "array",
          "description": "Stretches of the value the producer has already decided something about, in runes, in order and not overlapping.",
          "items": {
            "type": "object",
            "required": ["from", "to"],
            "properties": {
              "from": { "type": "integer", "minimum": 0 },
              "to": { "type": "integer", "minimum": 1 },
              "tone": { "enum": ["changed", "comment", "string", "number", "keyword", "name", "type"] }
            }
          }
        },
        "kind": { "$ref": "#/$defs/kind" }
      }
    },
    "kind": {
      "enum": ["", "text", "path", "count", "time", "ref"],
      "description": "Semantic, not presentational. A renderer decides truncation and alignment from it."
    },
    "mark": {
      "enum": ["", "here", "new", "working", "waiting", "done", "dirty", "blocked", "detached"],
      "description": "A state name, never a character. The renderer owns the glyph."
    },
    "action": {
      "type": "object",
      "required": ["key", "verb"],
      "properties": {
        "key": {
          "type": "string",
          "minLength": 1,
          "not": { "enum": ["/", "?", "q", "⎋", "esc", "j", "k", "g", "G", " "] },
          "description": "Unambiguous for a row, not across the panel. Renderer keys are reserved."
        },
        "label": { "type": "string" },
        "verb": {
          "type": "string",
          "minLength": 1,
          "description": "The command, in drive mode only. Never executed in select mode."
        },
        "args": {
          "type": "array",
          "items": { "type": "string" },
          "description": "{row}, {input} and {choice} are substituted as whole argv elements. There is no shell."
        },
        "input": {
          "type": "string",
          "description": "Prompt for one line; it becomes {input}."
        },
        "choices": {
          "type": "array",
          "items": { "type": "string" },
          "description": "Offer a list; the pick becomes {choice}."
        },
        "confirm": { "type": "string" },
        "panel": {
          "type": "string",
          "description": "This action's command prints another panel; render it instead of refreshing."
        },
        "global": {
          "type": "boolean",
          "description": "Applies to the screen, not a row."
        },
        "retry": {
          "type": "array",
          "items": { "$ref": "#/$defs/retry" },
          "description": "Offered on r when a refusal contains `when`."
        },
        "help": { "type": "string" }
      }
    },
    "retry": {
      "type": "object",
      "required": ["verb", "label"],
      "properties": {
        "when": {
          "type": "string",
          "description": "Matched against the refusal. Empty matches anything."
        },
        "label": { "type": "string", "minLength": 1 },
        "verb": { "type": "string", "minLength": 1 },
        "args": { "type": "array", "items": { "type": "string" } }
      }
    }
  }
}
